{
  "schemaVersion": "gatelm.difficulty-independent-dataset-split-manifest.v1",
  "datasetVersion": "difficulty_independent_ood_5000_2026_07_18_candidate_v1",
  "masterDatasetPath": "docs/v2.1.0/evaluation/difficulty-independent-ood-5000.v1.candidate.jsonl",
  "masterDatasetSha256": "045d1cd1072d5e5ea7c4bb445898627e8fe3a937b20a3dc076c07b04ce81b70d",
  "blindReviewPath": "docs/v2.1.0/reviews/difficulty-independent-ood-5000/difficulty-independent-ood-5000.v1.blind-review.jsonl",
  "blindReviewSha256": "bb253b94e7e107cd7ba09cb727070dea2addd3801956fe50f35ad779c394b9ea",
  "splitPolicyVersion": "difficulty-independent-ood-family-split.2026-07-18.v1",
  "splitSeed": 2026071803,
  "assignmentUnit": "prompt_family",
  "labelState": "labels_pending_human_review",
  "trainingEligible": false,
  "dataset1Isolation": {
    "dataset1Path": "docs/v2.1.0/training/difficulty-model-path-5000.owner-approved.jsonl",
    "usedAsGenerationInput": false,
    "usedForPostGenerationOverlapAudit": true,
    "sharedGeneratorModules": [],
    "familyNamespace": "independent2"
  },
  "standardManifestProjection": {
    "train": "train",
    "validation": "calibration",
    "test": "holdout"
  },
  "splits": {
    "train": {
      "datasetPath": "docs/v2.1.0/evaluation/difficulty-independent-ood-5000.v1.train.jsonl",
      "datasetSha256": "e1fa428c4d10ec3e06cbc8598ef99d896f26c7c8adccbe60f6d365446b4f0e09",
      "records": 3000,
      "families": 600,
      "purpose": "future_weight_fit_after_human_approval"
    },
    "validation": {
      "datasetPath": "docs/v2.1.0/evaluation/difficulty-independent-ood-5000.v1.validation.jsonl",
      "datasetSha256": "6de2709c584e8a9bc4ed2c09f80bdf77bb5253cb8c940d230f8a4b087e974c81",
      "records": 1000,
      "families": 200,
      "purpose": "future_model_selection_after_human_approval"
    },
    "test": {
      "datasetPath": "docs/v2.1.0/evaluation/difficulty-independent-ood-5000.v1.test.jsonl",
      "datasetSha256": "9ec29d055f06e5e8dba5bc59cc32a0f677ad242786a745bbe83097ba1c8aefd4",
      "records": 1000,
      "families": 200,
      "purpose": "untouched_final_evaluation_after_human_approval"
    }
  },
  "assignments": [
    {
      "promptFamily": "independent2.code.debugging.scenario.f006",
      "split": "train",
      "records": 5
    },
    {
      "promptFamily": "independent2.code.debugging.scenario.f012",
      "split": "train",
      "records": 5
    },
    {
      "promptFamily": "independent2.code.debugging.scenario.f018",
      "split": "train",
      "records": 5
    },
    {
      "promptFamily": "independent2.code.debugging.scenario.f024",
      "split": "train",
      "records": 5
    },
    {
      "promptFamily": "independent2.code.debugging.scenario.f030",
      "split": "train",
      "records": 5
    },
    {
      "promptFamily": "independent2.code.debugging.scenario.f036",
      "split": "train",
      "records": 5
    },
    {
      "promptFamily": "independent2.code.debugging.scenario.f042",
      "split": "train",
      "records": 5
    },
    {
      "promptFamily": "independent2.code.debugging.scenario.f048",
      "split": "train",
      "records": 5
    },
    {
      "promptFamily": "independent2.code.debugging.scenario.f054",
      "split": "train",
      "records": 5
    },
    {
      "promptFamily": "independent2.code.debugging.scenario.f060",
      "split": "train",
      "records": 5
    },
    {
      "promptFamily": "independent2.code.debugging.scenario.f066",
      "split": "validation",
      "records": 5
    },
    {
      "promptFamily": "independent2.code.debugging.scenario.f072",
      "split": "validation",
      "records": 5
    },
    {
      "promptFamily": "independent2.code.debugging.scenario.f078",
      "split": "validation",
      "records": 5
    },
    {
      "promptFamily": "independent2.code.debugging.scenario.f084",
      "split": "test",
      "records": 5
    },
    {
      "promptFamily": "independent2.code.debugging.scenario.f090",
      "split": "test",
      "records": 5
    },
    {
      "promptFamily": "independent2.code.debugging.scenario.f096",
      "split": "test",
      "records": 5
    },
    {
      "promptFamily": "independent2.code.debugging.scenario.f102",
      "split": "train",
      "records": 5
    },
    {
      "promptFamily": "independent2.code.debugging.scenario.f108",
      "split": "train",
      "records": 5
    },
    {
      "promptFamily": "independent2.code.debugging.scenario.f114",
      "split": "train",
      "records": 5
    },
    {
      "promptFamily": "independent2.code.debugging.scenario.f120",
      "split": "train",
      "records": 5
    },
    {
      "promptFamily": "independent2.code.debugging.scenario.f126",
      "split": "train",
      "records": 5
    },
    {
      "promptFamily": "independent2.code.debugging.scenario.f132",
      "split": "train",
      "records": 5
    },
    {
      "promptFamily": "independent2.code.debugging.scenario.f138",
      "split": "train",
      "records": 5
    },
    {
      "promptFamily": "independent2.code.debugging.scenario.f144",
      "split": "train",
      "records": 5
    },
    {
      "promptFamily": "independent2.code.debugging.scenario.f150",
      "split": "train",
      "records": 5
    },
    {
      "promptFamily": "independent2.code.debugging.scenario.f156",
      "split": "train",
      "records": 5
    },
    {
      "promptFamily": "independent2.code.debugging.scenario.f162",
      "split": "validation",
      "records": 5
    },
    {
      "promptFamily": "independent2.code.debugging.scenario.f168",
      "split": "validation",
      "records": 5
    },
    {
      "promptFamily": "independent2.code.debugging.scenario.f174",
      "split": "validation",
      "records": 5
    },
    {
      "promptFamily": "independent2.code.debugging.scenario.f180",
      "split": "validation",
      "records": 5
    },
    {
      "promptFamily": "independent2.code.debugging.scenario.f186",
      "split": "test",
      "records": 5
    },
    {
      "promptFamily": "independent2.code.debugging.scenario.f192",
      "split": "test",
      "records": 5
    },
    {
      "promptFamily": "independent2.code.debugging.scenario.f198",
      "split": "test",
      "records": 5
    },
    {
      "promptFamily": "independent2.code.design.scenario.f002",
      "split": "train",
      "records": 5
    },
    {
      "promptFamily": "independent2.code.design.scenario.f008",
      "split": "train",
      "records": 5
    },
    {
      "promptFamily": "independent2.code.design.scenario.f014",
      "split": "train",
      "records": 5
    },
    {
      "promptFamily": "independent2.code.design.scenario.f020",
      "split": "train",
      "records": 5
    },
    {
      "promptFamily": "independent2.code.design.scenario.f026",
      "split": "train",
      "records": 5
    },
    {
      "promptFamily": "independent2.code.design.scenario.f032",
      "split": "train",
      "records": 5
    },
    {
      "promptFamily": "independent2.code.design.scenario.f038",
      "split": "train",
      "records": 5
    },
    {
      "promptFamily": "independent2.code.design.scenario.f044",
      "split": "train",
      "records": 5
    },
    {
      "promptFamily": "independent2.code.design.scenario.f050",
      "split": "train",
      "records": 5
    },
    {
      "promptFamily": "independent2.code.design.scenario.f056",
      "split": "train",
      "records": 5
    },
    {
      "promptFamily": "independent2.code.design.scenario.f062",
      "split": "validation",
      "records": 5
    },
    {
      "promptFamily": "independent2.code.design.scenario.f068",
      "split": "validation",
      "records": 5
    },
    {
      "promptFamily": "independent2.code.design.scenario.f074",
      "split": "validation",
      "records": 5
    },
    {
      "promptFamily": "independent2.code.design.scenario.f080",
      "split": "validation",
      "records": 5
    },
    {
      "promptFamily": "independent2.code.design.scenario.f086",
      "split": "test",
      "records": 5
    },
    {
      "promptFamily": "independent2.code.design.scenario.f092",
      "split": "test",
      "records": 5
    },
    {
      "promptFamily": "independent2.code.design.scenario.f098",
      "split": "test",
      "records": 5
    },
    {
      "promptFamily": "independent2.code.design.scenario.f104",
      "split": "train",
      "records": 5
    },
    {
      "promptFamily": "independent2.code.design.scenario.f110",
      "split": "train",
      "records": 5
    },
    {
      "promptFamily": "independent2.code.design.scenario.f116",
      "split": "train",
      "records": 5
    },
    {
      "promptFamily": "independent2.code.design.scenario.f122",
      "split": "train",
      "records": 5
    },
    {
      "promptFamily": "independent2.code.design.scenario.f128",
      "split": "train",
      "records": 5
    },
    {
      "promptFamily": "independent2.code.design.scenario.f134",
      "split": "train",
      "records": 5
    },
    {
      "promptFamily": "independent2.code.design.scenario.f140",
      "split": "train",
      "records": 5
    },
    {
      "promptFamily": "independent2.code.design.scenario.f146",
      "split": "train",
      "records": 5
    },
    {
      "promptFamily": "independent2.code.design.scenario.f152",
      "split": "train",
      "records": 5
    },
    {
      "promptFamily": "independent2.code.design.scenario.f158",
      "split": "train",
      "records": 5
    },
    {
      "promptFamily": "independent2.code.design.scenario.f164",
      "split": "validation",
      "records": 5
    },
    {
      "promptFamily": "independent2.code.design.scenario.f170",
      "split": "validation",
      "records": 5
    },
    {
      "promptFamily": "independent2.code.design.scenario.f176",
      "split": "validation",
      "records": 5
    },
    {
      "promptFamily": "independent2.code.design.scenario.f182",
      "split": "test",